{"$id":"urn:hivehub:schema:learning-bundle:1","$schema":"https://json-schema.org/draft/2020-12/schema","additionalProperties":false,"properties":{"artifacts":{"items":{"additionalProperties":false,"properties":{"content":{"type":"string"},"content_address":{"pattern":"^urn:hivehub:sha256:[0-9a-f]{64}$","type":"string"},"encoding":{"const":"utf-8"},"media_type":{"maxLength":4096,"minLength":1,"type":"string"},"name":{"maxLength":4096,"minLength":1,"type":"string"}},"required":["name","media_type","encoding","content","content_address"],"type":"object"},"maxItems":256,"type":"array"},"bundle_version":{"maxLength":4096,"minLength":1,"type":"string"},"conformance_contract":{"additionalProperties":false,"properties":{"kind":{"const":"conformance-contract"},"requirements":{"items":{"additionalProperties":false,"properties":{"description":{"type":"string"},"id":{"pattern":"^[a-z0-9][a-z0-9._-]*$","type":"string"}},"required":["id","description"],"type":"object"},"maxItems":256,"type":"array"},"schema_version":{"const":1},"version":{"maxLength":4096,"minLength":1,"type":"string"}},"required":["kind","schema_version","version","requirements"],"type":"object"},"kind":{"const":"learning-bundle"},"protocol_fingerprint":{"pattern":"^urn:hivehub:sha256:[0-9a-f]{64}$","type":"string"},"schema_version":{"const":1},"summary":{"maxLength":4096,"minLength":1,"type":"string"}},"required":["kind","schema_version","protocol_fingerprint","bundle_version","summary","conformance_contract","artifacts"],"title":"learning-bundle","type":"object"}
