{"artifacts":[{"content":"{\"convention\":{\"branch\":\"experimental/hive-md\",\"checker\":{\"command\":\"python agents/hive_agent.py check <hive-folder> --root <root>\",\"path\":\"agents/hive_agent.py\",\"sha256\":\"e9a2d7243da31fd2388f140bb8138c3d8d2db428ad09075530eb049a0355e8dd\"},\"commit\":\"2bd7c95152ede719b6418b80e2bdc2cd457bf711\",\"repository\":\"https://github.com/kody-w/rapp-model-hive\",\"spec\":{\"path\":\"HIVE-MD.md\",\"sha256\":\"f3186e0d88cc36e18582171fff4ed9a68feddc4ae316f66fb8acc2982892fd96\"}},\"executes\":false,\"handoff\":{\"arguments\":{\"address\":\"address\",\"id\":\"root\"},\"hive_agent_action\":\"join\",\"performed_by\":\"person-brainstem\",\"writes\":\"one SSH-signed request file (request: rapp-hive)\"},\"hive_writes\":false,\"network\":false,\"pins\":{\"address_schemes\":[\"git\",\"https\",\"ssh\"],\"artifact\":\"hive-md/dial-pins.json\",\"credentials\":false,\"kind\":\"hive-md-dial-pins\",\"local_paths\":false,\"optional\":[\"public_copy\"],\"public_copy_schemes\":[\"https\"],\"required\":[\"address\",\"founder\",\"hive\",\"root\"]},\"schema\":\"hive-md/0\",\"status\":\"experimental\"}","content_address":"urn:hivehub:sha256:fb52cd3ebcb07a85b19298a12ca6f26fd448505d231c7951382a9606acfb9824","encoding":"utf-8","media_type":"application/json","name":"hive-md/adapter-contract.json"},{"content":"{\"address\":\"https://contoso.invalid/hives/contoso-onboarding.git\",\"founder\":\"SHA256:q18VTrWDieC+Sc25wpbcIHm4/gUotkmUJpyFgDeOdyY\",\"hive\":\"185d0eb5d4b1247b260042d0d840d5c3\",\"kind\":\"hive-md-dial-pins\",\"public_copy\":\"https://github.com/kody-w/rapp-model-hive/tree/2bd7c95152ede719b6418b80e2bdc2cd457bf711/example/contoso-onboarding-public\",\"root\":\"f934db89e0c73d71843d634b8ddbd53154732735\",\"schema_version\":1}\n","content_address":"urn:hivehub:sha256:6afcd2eb873ad46ac0547615e349efaad3dc53f5ca360c3a3a0038640698cb5a","encoding":"utf-8","media_type":"application/json","name":"hive-md/dial-pins.json"},{"content":"# hive-md: a folder Hive (experimental)\n\nA folder Hive is a git repository of markdown files: `HIVE.md` holds its rules,\n`members/<name>/` is each member's space with device keys in\n`members/<name>/keys/<device>.md`, `requests/` holds requests to join, `shared/`\nholds the rooms and `former/` the spaces of members who left. Every change is an\nSSH-signed commit, judged by the Hive as it stood at its parent. Transport carries;\nsignatures decide.\n\nThe convention is `HIVE-MD.md` at `kody-w/rapp-model-hive@2bd7c95152ede719b6418b80e2bdc2cd457bf711`\n(SHA-256 `f3186e0d88cc36e18582171fff4ed9a68feddc4ae316f66fb8acc2982892fd96`). Its checker is `agents/hive_agent.py`\n(SHA-256 `e9a2d7243da31fd2388f140bb8138c3d8d2db428ad09075530eb049a0355e8dd`): `python agents/hive_agent.py check <hive-folder> --root <root>`.\n\n## Dial pins\n\n`hive-md/dial-pins.json` holds exactly these pins:\n\n- `address`: the shared copy's git URL (ssh, https or git). It may be private. It is\n  never a local path and never carries a user name, password or token.\n- `hive`: the Hive id from `HIVE.md` (32 lowercase hexadecimal characters).\n- `root`: the full id of the Hive's first commit, which the joining device pins.\n- `founder`: the founder key's SSH fingerprint (`SHA256:` and 43 base64 characters).\n- `public_copy` (optional): the https URL of the reviewed public copy, a separate\n  repository with `PUBLISHED.md` checked with `check-public`. It is the Hive's only\n  public face.\n\n## Joining\n\nJoining through Hive Hub saves a reversible local subscription and nothing else. The\nnext step happens in your own Brainstem: its Hive agent `join`, given exactly\n`address` and `id` = `root`, proposes first. After your yes in a later turn it copies\nthe shared copy, checks every commit from the root, pins the root and the Hive id,\nshows the founder key fingerprint and files one SSH-signed request file\n(`request: rapp-hive`) at `requests/<name>/<device>.md`. Members admit you by moving\nthat file into `members/<name>/keys/`. New Hives start at 2 approvals.\n\nHive Hub never reaches the address, writes into a Hive, runs the Hive agent or its\nchecker, or holds a key, so it cannot tell a private shared copy from a missing one.\n`rapp-hive/1` remains the Private Hive profile in force; `rapp-hive/2` is frozen as a\nresearch record.\n","content_address":"urn:hivehub:sha256:4573b860e106c7fec5a9a33a0cdcd3f3a24010af0cdad71e97b87232c4836f3b","encoding":"utf-8","media_type":"text/markdown","name":"hive-md/folder-hive.md"}],"bundle_version":"0-2bd7c95","conformance_contract":{"kind":"conformance-contract","requirements":[{"description":"Joining happens in the person's own Brainstem: its Hive agent join, given exactly the address pin and id = the root pin, copies the shared copy, checks every commit from that root and writes one SSH-signed request file (request: rapp-hive) at requests/<name>/<device>.md. Members admit it by moving it into members/<name>/keys/; new Hives start at 2 approvals.","id":"brainstem-join"},{"description":"python agents/hive_agent.py check <hive-folder> --root <root> passes: every commit after the pinned root has one parent and is signed by a key that its parent lists under members/<name>/keys/, within the rules. Checker: agents/hive_agent.py at kody-w/rapp-model-hive@2bd7c95152ede719b6418b80e2bdc2cd457bf711, SHA-256 e9a2d7243da31fd2388f140bb8138c3d8d2db428ad09075530eb049a0355e8dd.","id":"checker"},{"description":"The Hive follows HIVE-MD.md at kody-w/rapp-model-hive@2bd7c95152ede719b6418b80e2bdc2cd457bf711, SHA-256 f3186e0d88cc36e18582171fff4ed9a68feddc4ae316f66fb8acc2982892fd96: a git repository of markdown files with HIVE.md, members/<name>/keys/<device>.md, requests/, shared/ and former/.","id":"convention"},{"description":"The record's learning bundle carries hive-md/dial-pins.json with exactly address (a credential-free ssh, https or git URL, never a local path), hive (32 lowercase hex), root (the 40-hex first commit) and founder (SHA256:<43 base64>), plus an optional https public_copy; the record's URLs are exactly its URL-valued pins.","id":"dial-pins"},{"description":"Hive Hub only validates the pins and hands them to the person's Brainstem. It never reaches the address, writes into a Hive, runs the Hive agent or its checker, or holds a key, so a private shared copy and a missing one look the same.","id":"hive-hub-inert"},{"description":"The joining Brainstem pins the root commit and the Hive id and shows the founder key fingerprint. The root fixes both; if either differs from its dial pin, the record is wrong and the person stops.","id":"pinned-identity"},{"description":"A named public_copy is a separate reviewed repository with PUBLISHED.md, checked with check-public; it is the Hive's only public face.","id":"public-copy"}],"schema_version":1,"version":"0-experimental"},"kind":"learning-bundle","protocol_fingerprint":"urn:hivehub:sha256:6f6cb57893764dad9311813ed5d08d1a8788c1c0334e0382cd41901d7b0bafc5","schema_version":1,"summary":"Inert learning for the experimental hive-md folder-Hive convention and this Hive's dial pins (hive-md/dial-pins.json); nothing in it runs."}
